{"schemaVersion":1,"pairCommitment":"aaaaaaaaaaaaaaaaaaaaaaaaaaaaaaaaaaaaaaaaaaaaaaaaaaaaaaaaaaaaaaaa","reportCommitment":"bbbbbbbbbbbbbbbbbbbbbbbbbbbbbbbbbbbbbbbbbbbbbbbbbbbbbbbbbbbbbbbb","proofRootSha256":"cccccccccccccccccccccccccccccccccccccccccccccccccccccccccccccccc","inventoryCommitment":"dddddddddddddddddddddddddddddddddddddddddddddddddddddddddddddddd","scheduledAt":"2026-09-30T00:00:00Z","deletedAt":"2026-09-30T00:01:00Z","status":"succeeded","operator":"proof-retention-coordinator","proofCopiesDeleted":true,"externalUserSourcesRetained":true,"method":"logical-filesystem-delete","physicalSecureErasureGuaranteed":false,"failureReasons":[]}
